good_sentence,bad_sentence,suite,suite_broad,wang2021_id,item_id
警官 解除 了 封锁 和 警报 。,警官 解除 了 封锁 和 出口 。,vo_para,Verb_Noun,25,494
他 摘 过 一些 蔬菜 和 水果 。,他 摘 过 一些 蔬菜 和 化肥 。,vo_para,Verb_Noun,26,495
她 佩戴 过 戒指 和 耳机 。,她 佩戴 过 戒指 和 衣服 。,vo_para,Verb_Noun,27,496
他 在 学校 里 讲 过 讲座 和 课 。,他 在 学校 里 讲 过 讲座 和 饭 。,vo_para,Verb_Noun,28,497
他 去 过 仓库 和 商店 。,他 去 过 仓库 和 店长 。,vo_para,Verb_Noun,29,498
我 看 过 这些 文字 和 画面 。,我 看 过 这些 文字 和 声音 。,vo_para,Verb_Noun,30,499
爷爷 安装 过 家具 和 机器 。,爷爷 安装 过 家具 和 蔬菜 。,vo_para,Verb_Noun,31,500
她 吃 过 这 些 菜 和 鱼 。,她 吃 过 这 些 菜 和 话 。,vo_para,Verb_Noun,32,501
母亲 喝 过 咖啡 和 茶 。,母亲 喝 过 咖啡 和 纸 。,vo_para,Verb_Noun,33,502
那 位 教授 写 了 书 的 内容 。,那 位 教授 写 了 书 的 作者 。,vo_none,Verb_Noun,1,503
弟弟 开 了 父亲 的 车 。,弟弟 开 了 父亲 的 诗 。,vo_none,Verb_Noun,2,504
他 读 了 桌子 上 的 报纸 。,他 读 了 桌子 上 的 筷子 。,vo_none,Verb_Noun,3,505
她 终于 实现 了 她 的 理想 。,她 终于 实现 了 她 的 任务 。,vo_none,Verb_Noun,4,506
我 修理 了 这个 电脑 。,我 修理 了 这个 故事 。,vo_none,Verb_Noun,5,507
他 承担 了 我 的 责任 。,他 承担 了 我 的 爱好 。,vo_none,Verb_Noun,6,508
我 邀请 过 我 的 朋友 。,我 邀请 过 我 的 音响 。,vo_none,Verb_Noun,7,509
老师 拿出 了 他 的 篮子 。,老师 拿出 了 他 的 梦想 。,vo_none,Verb_Noun,8,510
记者 采访 了 艺术家 。,记者 采访 了 艺术品 。,vo_none,Verb_Noun,9,511
他 参与 了 战争 。,他 参与 了 医院 。,vo_none,Verb_Noun,10,512
她 增大 了 学习 力度 。,她 增大 了 学习 效率 。,vo_none,Verb_Noun,11,513
我 结束 了 谈话 。,我 结束 了 对方 。,vo_none,Verb_Noun,12,514
他 种 了 这些 花 。,他 种 了 这些 笔 。,vo_none,Verb_Noun,13,515
他 申请 了 很多 工作 。,他 申请 了 很多 问题 。,vo_none,Verb_Noun,14,516
这 款 药 缓解 了 他 的 症状 。,这 款 药 缓解 了 他 的 疾病 。,vo_none,Verb_Noun,15,517
我 听 着 奶奶 的 声音 。,我 听 着 奶奶 的 面容 。,vo_none,Verb_Noun,16,518
科学家 发明 了 这个 药品 。,科学家 发明 了 这个 规律 。,vo_none,Verb_Noun,17,519
母亲 责备 了 孩子 。,母亲 责备 了 晚饭 。,vo_none,Verb_Noun,18,520
孩子 改正 了 这个 习惯 。,孩子 改正 了 这个 特长 。,vo_none,Verb_Noun,19,521
政府 建造 了 公园 。,政府 建造 了 大海 。,vo_none,Verb_Noun,20,522
我 吸取 了 之前 的 教训 。,我 吸取 了 之前 的 经历 。,vo_none,Verb_Noun,21,523
花园 长满 了 草 。,花园 长满 了 水 。,vo_none,Verb_Noun,22,524
雨水 灌溉 了 田地 。,雨水 灌溉 了 大楼 。,vo_none,Verb_Noun,23,525
我 听从 了 老师 的 建议 。,我 听从 了 老师 的 回忆 。,vo_none,Verb_Noun,24,526
警官 解除 了 警报 。,警官 解除 了 出口 。,vo_none,Verb_Noun,25,527
他 摘 过 一些 水果 。,他 摘 过 一些 化肥 。,vo_none,Verb_Noun,26,528
她 佩戴 过 耳机 。,她 佩戴 过 衣服 。,vo_none,Verb_Noun,27,529
他 在 学校 里 讲 过 课 。,他 在 学校 里 讲 过 饭 。,vo_none,Verb_Noun,28,530
他 去 过 商店 。,他 去 过 店长 。,vo_none,Verb_Noun,29,531
我 看 过 这些 画面 。,我 看 过 这些 声音 。,vo_none,Verb_Noun,30,532
爷爷 安装 过 机器 。,爷爷 安装 过 蔬菜 。,vo_none,Verb_Noun,31,533
她 吃 过 这 些 鱼 。,她 吃 过 这 些 话 。,vo_none,Verb_Noun,32,534
母亲 喝 过 茶 。,母亲 喝 过 纸 。,vo_none,Verb_Noun,33,535
